{
  "athlete_name": "Kalpana",
  "age": 19,
  "gender": "Female",
  "height_cm": null,
  "weight_kg": null,
  "bow_type": "Recurve",
  "discipline": "Olympic Recurve",
  "draw_hand": "right",
  "camera_view": "side-on (bow-arm side)",
  "camera_distance_m": null,
  "session_date": "2026-08-13",
  "declared_frame_rate": null,
  "number_of_shots_expected": null,
  "additional_data": [],
  "notes": "",
  "inputs_raw": null,
  "inputs_unparsed": [],
  "manual_phase_overrides": null,
  "physio": {
    "heart_rate": {
      "rest_bpm": null,
      "mean_bpm": null,
      "max_bpm": null
    },
    "force_plate": {
      "file": null,
      "images": []
    }
  }
}
